<?xml version="1.0" encoding="UTF-8"?>
<!--
    Author: Leonardo Amancio
    Student ID: 2017401
    Group: A
    Subject: Interactive Web Applications
    Lecturer: Mikhail Timofeev
    Code version: 1.0.0 - 02 Dec, 2020
-->
<stock xmlns:xsi="http://www.w3.org/2001/XMLSchema-instance"
       xsi:noNamespaceSchemaLocation="inventory.xsd">
    <products>
        <product id=" 2343">
            <sku>leo-9133</sku>
            <name>fluffy pillow</name>
            <product_url>https://bit.ly/3nvecmm</product_url>
            <thumbnail_url>https://tinyurl.com/y9chrwz5</thumbnail_url>
            <price>24.99</price>
            <retail_price>24.99</retail_price>
            <search_keywords>fluffy, pillow, white</search_keywords>
            <description>it's really fluffy ...</description>
            <category>home</category>
            <category_id>0298</category_id>
            <brand>pillow master</brand>
            <colour>white</colour>
            <width>0.40</width>
            <length>0.20</length>
            <inventory_count>21</inventory_count>
            <date_created>2018-03-03T17:41:13</date_created>
        </product>
        <product id=" 2323">
            <sku>leo-9133</sku>
            <name>scruffy pillow</name>
            <product_url>https://bit.ly/3nvecmm</product_url>
            <thumbnail_url>https://bit.ly/3amdfx6</thumbnail_url>
            <price>24.99</price>
            <retail_price>24.99</retail_price>
            <search_keywords>fluffy, pillow, white</search_keywords>
            <description>it's really fluffy ...</description>
            <category>home</category>
            <category_id>0298</category_id>
            <brand>pillow master</brand>
            <colour>white</colour>
            <width>0.40</width>
            <length>0.20</length>
            <inventory_count>21</inventory_count>
            <date_created>2018-03-03T17:41:13</date_created>
        </product>
    </products>
</stock>